url,source,title,text,timestamp
https://www.foxnews.com/world/blinken-reminds-israel-biden-admin-committed-two-state-solution-following-netanyahu-appointment,fox,Blinken reminds Israel Biden admin committed to 'two-state solution ...," close      Video Fox News Flash top headlines for January 3 Fox News Flash top headlines are here. Check out what's clicking on Foxnews.com.Secretary of State Antony Blinken congratulated Israel’s Eli Cohen on his appointment as foreign minister and reminded the newest appointee in the Netanyahu administration of the U.S.’s position when it comes to a two-state solution with its Palestinian neighbors.In a call Monday, the pair discussed U.S. - Israeli relations, mutual interests and regional security. However, according to a readout, Blinken also ""emphasized the continued U.S. commitment to a two-state solution and opposition to policies that endanger its viability.""The comments from the secretary comes just days after Benjamin Netanyahu was sworn in as Israeli Prime Minister for the sixth time in a dramatic return to power.   Secretary of State Antony Blinken meets Israeli Prime Minister Benjamin Netanyahu on the first leg of his four-day trip to the Middle East, on May 25, 2021 in Jerusalem. (Photos by Haim Zach / GPO via Getty Images)BENJAMIN NETANYAHU RETURNS TO POWER IN ISRAEL AS NEW GOVERNMENT IS SWORN INNetanyahu was ousted in Jun 2021 and is still on trial for corruption charges.However, the popular right wing figurehead – who secured another term and ushered in one of the most hard-right cabinets Israel has seen – is expected to push for settlement advancement in the Palestinian West Bank, reported Reuters.Netanyahu has allied his party with the Religious Zionism and Jewish Power parties which opposed Palestinian statehood.Leader of the Religious Zionism party, Bezalel Smotrich, was also appointed as minister of finance Sunday and vowed that ""Israel will be an island of stability and responsibility,"" Reuters reported.   Israeli Prime Minister Benjamin Netanyahu and Minister of National Security Itamar Ben-Gvir react after sworn in at the Israeli parliament during a new government sworn in discussion at the Israeli parliament on Dec. 29, 2022 in Jerusalem. (Photo by Amir Levy/Getty Images)HOLY LAND FIGHT: ISRAELI LAWMAKERS CONDEMN EU'S 'ILLEGAL' ACTIONS ON BIBLICAL LANDIsrael's police minister appointee, Itamar Ben-Gvir, has also turned heads as he was reportedly convicted in 2007 for inciting violence against Arabs and supporting a Jewish militant group.The newest police minister made headlines during his campaign for saying ""every police officer should know that if a terrorist comes to hurt you his blood is forfeit,"" Reuters stated. Netanyahu vowed to prioritize countering Iranian aggression and bringing peace to the region following his election; however, some fear concessions he made to his hard right cabinet could see further violations to boundaries identified under a 1967 U.N. resolution.   A woman holds a map of Palestine from 1946 to 2020. Supporters of Palestine organized a gathering in Toulouse against the planned annexation of parts of West Bank and the total annexation of the Jordan Valley by Netanyahu government on July 1, 2020.  (Photo by Alain Pitton/NurPhoto via Getty Images)CLICK HERE TO GET THE FOX NEWS APPPresident Biden also congratulated Netanyahu and his administration upon securing the high office, but he stood firm on his desire for a two-state solution when it comes to Israel-Palestinian relations. ""The United States will continue to support the two-state solution and to oppose policies that endanger its viability or contradict our mutual interests and values,"" he said.  Caitlin McFall is a Reporter at Fox News Digital covering Politics, U.S. and World news.",2021-03-08 02:33:00
https://www.foxnews.com/world/ukraine-decries-israel-russia-chat-suggests-change-policy-new-netanyahu-admin,fox,"Ukraine decries Israel, Russia chat and suggests 'change of policy ..."," close      Video Russia, Ukraine 'not in the mood to comprise' for peace talks: Michael Allen Former Special Assistant for National Security to President George W. Bush, Michael Allen discusses dwindling peace talks between Volodymyr Zelenskyy and Vladimir Putin, the Iranian regime's handling of protests and the nuclear deal.Ukraine’s ambassador to Israel condemned a call this week between Russian Foreign Minister Sergei Lavrov and Israel’s newest top diplomat Eli Cohen, who was appointed as foreign minister late last month, suggesting there has been a change in policy between Moscow and Jerusalem.""Israel’s minister of foreign affairs hasn’t spoken to Lavrov since the war started,"" Ukrainian Ambassador Yevgen Korniychuk told the Times of Israel Tuesday in reference to the former foreign minister, Yair Lapid.But the election of Prime Minister Benjamin Netanyahu and the appointment of his hard right cabinet suggest there will be changes not only in Israel but with how it engages with international partners.  Russian President Vladimir Putin greets Israeli Prime Minister Benjamin Netanyahu during their meeting on Jan. 30, 2020, in Moscow. (Mikhail Svetlov/Getty Images)BLINKEN REMINDS ISRAEL BIDEN ADMIN COMMITTED TO 'TWO-STATE SOLUTION' FOLLOWING NETANYAHU APPOINTMENTKorniychuk said Israel is ""unique in terms of our partners"" and noted that despite humanitarian aid it has provided Kyiv, Jerusalem has remained ""silent"" when it comes to condemning Russia’s war in Ukraine, notably the attacks on civilian targets. ""Unfortunately, we are getting no condemnation of the mass shelling of our civilians in recent months,"" he added, according to the Israeli news outlet. Korniychuk said Israel’s position on the war is ""unclear,"" but according to one Israeli official who spoke following the Lavrov-Cohen chat, ""there is no change in Israel’s policy.""Cohen sparked international condemnation this week during his first speech as Israeli foreign minister when he addressed the war in Ukraine, saying, ""With regard to the Russia-Ukraine issue, we will do one thing for certain – in public – we will talk less.""Top supporters for aid to Ukraine like Sen. Lindsey Graham, R-S.C., pushed back on Cohen’s comments and said, ""The idea that Israel should speak less about Russia’s criminal invasion of Ukraine is a bit unnerving.""""I hope Mr. Cohen understands that when he speaks to Russia’s Lavrov, he’s speaking to a representative of a war criminal regime that commits war crimes on an industrial scale every day,"" he added.   Israeli Foreign Minister Eli Cohen speaks during a press conference in Jerusalem on Jan. 2, 2023. (Israel Foreign Ministry handout/Anadolu Agency via Getty Images)UKRAINE'S ZELENSKYY SAYS HE'S 'COUNTING' ON ISRAEL TO SANCTION RUSSIA, JERUSALEM REMAINS QUIET ON PENALTIESUkrainian Foreign Minister Dmytro Kuleba has not reportedly spoken with his new Israeli counterpart, though Netanyahu has spoken with both Russian President Vladimir Putin and Ukrainian President Volodymyr Zelenskyy.Netanyahu from the campaign trail suggested under his leadership Israel might begin providing arms to Kyiv, but Zelenskyy seemed unconvinced following a recent call with the six-term prime minister.According to a report by Axios last week, Netanyahua called Zelenskyy ahead of a United Nations General Assembly vote on a resolution that called on the International Court of Justice to provide a legal opinion on the ramifications of Israel’s occupation of Palestinian lands as defined by pre-1967 boundaries agreed to under the U.N.Netanyahu allegedly asked Zelenskyy to either vote against the resolution – which was approved by 87 nations while 24 countries voted against and 53 nations abstained – or to abstain from voting altogether. Zelenskyy pushed back and asked if Israel would provide air support against Russia’s assault, a proposition the Israeli leader supposedly said he would consider.   Ukrainian President Volodymyr Zelenskyy attends meeting with military officials as he visits the war-hit Mykolaiv region on June 18, 2022. (Ukrainian Presidential Press Office via AP)CLICK HERE TO GET THE FOX NEWS APPZelenskyy apparently did not like the noncommittal answer and instructed Ukraine’s diplomat to the U.N. not to attend the vote – a move that sidestepped Netanyahu’s wishes. The Israeli leader was reportedly disappointed by the decision. Fox News could not immediately reach the Israeli foreign ministry for comment.  Caitlin McFall is a Reporter at Fox News Digital covering Politics, U.S. and World news.",2021-03-08 02:33:00
https://www.foxnews.com/world/syria-says-israeli-airstrike-shut-down-damascus-airport-killing-2-soldiers-wounding-2-others,fox,"Syria says Israeli airstrike shut down Damascus airport, killing 2 ..."," close      Video  Israeli Prime Minister Netanyahu is back in power Fox News correspondent Trey Yingst has the latest on the prime minister's sixth term on 'Special Report.'The Syrian Army says Israel has fired missiles at the international airport in Damascus, adding it took the airport out of service temporarily, killed two soldiers, and wounded two others.The attack, which occurred shortly after midnight Sunday, was the second in seven months to put the Damascus International Airport out of commission. It caused material damage in a nearby area, the army said, without giving further details.Syria’s Ministry of Transport said work to repair the damage began immediately and later Monday, some flights resumed while work in other parts of the airport continued.An opposition war monitor reported the Israeli strikes hit the airport as well as an arms depot close to the facility south of Damascus. The Britain-based Syrian Observatory for Human Rights said four people were killed in the strike while the Syrian government reported that two had been killed.BIBLICAL SITE WHERE JESUS HEALED BLIND MAN EXCAVATED FOR PUBLIC VIEW: 'AFFIRMS SCRIPTURE'  Israel's Prime Minister Benjamin Netanyahu delivers a speech in Munich, Germany, Feb. 18, 2018. (Sven Hoppe/dpa via AP)Israeli Prime Minister Benjamin Netanyahu, who returned to power last week, has repeatedly promised to push back against Iran’s nuclear and strategic ambitions in the region which often involve Syria’s proxy involvement.""Almost a decade has passed since Israel began its ‘campaign between wars’ in Syria, whose pace of airstrikes – according to IDF chief of staff Lt.-Gen. Aviv Kohavi – has increased from once in every four months at the outset to once per week today,"" Mark Dubowitz, Foundation for Defense of Democracies chief executive, told Fox News Digital.IRAN HOLDS TOP MILITARY DRILLS IN MAJOR OIL WATERWAY IN 'WAR BEFORE THE WAR'   Syrian President Bashar Assad casts his ballot in the parliamentary elections, as his wife Asma, stands next to him, in Damascus, Syria. (Syrian Presidency via AP, File)""Syrian airports have increasingly been targeted – a reflection of their increasing use by Iran for unloading advanced weaponry destined for terror groups on Israel’s border and Hezbollah in Lebanon. That Damascus International Airport appears to have resumed some operations within eight hours of Monday’s strike is a testament to Israeli precision in carrying out the strike.""Israel has not publicly confirmed the strike but Netanyahu spoke during a cabinet meeting on Tuesday and reaffirmed his opposition to a nuclear deal with Iran that appears to have stalled in recent months.NETANYAHU: IRAN NUCLEAR DEAL IS ‘PROBABLY DEAD’; PROTESTS REVEAL THAT REGIME IS ‘REALLY WEAK’  U.S. Chairman of the Joint Chiefs of Staff Mark Milley, right, and Israel's Chief of General Staff Aviv Kohavi watch a live-fire exercise at Tze'elim military base in Israel on Sept. 15, 2022. (Ilia Yefimovich/picture alliance via Getty Images)""We will work openly, from a position of strength, in the international arena against a return to the nuclear agreement,"" Netanyahu said. ""Not only in talks with leaders behind closed doors but strongly and openly in the sphere of global opinion, which is now aware of the true dangers posed by Iran – the Iranian regime that is killing innocent citizens in and outside Iran.""Netanyahu warned that supporters of a return to a nuclear deal with Iran may attempt to resuscitate it in the future and that there is a ""possibility"" it has ""not yet finally disappeared from the agenda.""HOLY LAND FIGHT: ISRAELI LAWMAKERS CONDEMN EU'S 'ILLEGAL' ACTIONS ON BIBLICAL LAND""Therefore, we will do everything to prevent the return to this bad agreement, which is leading to a nuclear Iran under international auspices. We will also take vigorous action to prevent the Iranian military entrenchment in Syria and elsewhere and we will not wait.""Israel has carried out hundreds of strikes on targets inside government-controlled parts of Syria in recent years, but rarely acknowledges or discusses such operations.Israel has acknowledged, however, that it targets bases of Iran-allied militant groups, such as Lebanon’s Hezbollah, which has sent thousands of fighters to support Syrian President Bashar Assad’s forces.CLICK HERE TO GET THE FOX NEWS APPThousands of Iran-backed fighters have joined Syria’s 11-year civil war and helped tip the balance of power in Assad’s favor.Israel says an Iranian presence on its northern frontier is a red line that justifies its strikes on facilities and weapons inside Syria.The Associated Press and Fox News' Yonat Friling contributed to this report.  Andrew Mark Miller is a writer at Fox News. Find him on Twitter @andymarkmiller and email tips to AndrewMark.Miller@Fox.com.",2021-03-08 02:33:00
https://www.foxnews.com/world/fight-over-jerusalems-temple-mount-holy-site-why-is-it-important-jews-muslims-and-christians,fox,Fight over Jerusalem's Temple Mount holy site: Why is it so ...," close      Video Biblical site where Jesus healed blind man open to public after 2,000 years Ze'ev Orenstein of the City of David Foundation shares details about Jerusalem's Pool of Siloam, the site where Jesus healed a blind man over 2,000 years ago.JERUSALEM - Israel’s new right-wing National Security Minister Itamar Ben-Gvir managed to upset the U.S., France, the Palestinians and Sunni Arab countries on Tuesday due to his 15-minute visit to the holiest site for Jews, called the Temple Mount. It is now reported that the U.N. Security Council will meet later this week in New York to discuss the visit.The area is also the third most important site in Islam, the Al-Aqsa Mosque, which is also located on the Temple Mount—the Jewish name for the compound—in the Old City of Jerusalem. The Temple Mount is where both temples stood in Jerusalem before they were destroyed by invading armies.Israel’s new right-of-center coalition government entered office last week. Since Israel captured the Temple Mount in the Old City of Jerusalem during the 1967 Six-Day War, Israeli governments have permitted the Jordanian religious institution, the Waqf, to manage the Temple Mount and Al-Aqsa Mosque. Jews and Christians are largely not permitted to pray on the Temple Mount, and there are severe restrictions for non-Muslim visitors to enter the compound. The controversial firebrand Ben-Gvir tweeted a picture of himself on the Temple Mount with security officials, writing, ""The Israeli government of which I am a member will not surrender to a vile organization of murderers. The Temple Mount is open to all and if Hamas thinks that if it threatens me, that will deter me, they had better understand that times have changed. There is a government in Jerusalem.""   The Temple Mount and the Al-Aqsa Mosque in Jerusalem. (iStock)BENJAMIN NETANYAHU RETURNS TO POWER IN ISRAEL AS NEW GOVERNMENT IS SWORN IN Israel has declared all of Jerusalem its indivisible capital. Palestinians want East Jerusalem, where the Temple Mount is situated, as their capital of an independent a state along with the absorption of the disputed West Bank territory. The Temple Mount is the most significant holy site for Jews because two ancient temples were located on the compound and later destroyed. The Babylonians destroyed the First Temple in 586 B.C., and the Romans annihilated the Second Temple in year 70.  A section of the Second Temple—the Western Wall—is still standing.According to Jewish tradition, the 3,000-year-old Temple Mount is the location where God collected dust to create Adam—the first human being. The Temple Mount is also holy for Jews because it is the location where Abraham almost sacrificed his son Isaac to affirm his faith. The Jewish King Solomon built the First Temple of the Jews at the site. Muslims also term the Temple Mount the Haram al-Sharif, the Noble Sanctuary, where the Al-Aqsa Mosque and Dome of the Rock are located. The founder of Islam, Prophet Muhammed is, according to tradition, said to have ascended to heaven from the Noble Sanctuary.  Muslim worshipers fill the grounds outside the Al-Aqsa mosque on the last Friday of Ramadan, Dec. 31. About 400,000 Muslims packed Islam's thrid holiest shrine during this holy month of fasting and prayer. (Reuters)For Christians, the site is very significant as it was where Jesus would have been as a young boy, where he attended festivals, and he is also said to have taught there. Additionally, it's believed that Jesus foretold the destruction of the temple while there.   Rev. Dr. Petra Heltd, a leading Christian scholar, told Fox News Digital that ""The significance of the Temple Mount cannot be overstated in the Christian world. We can go back to the New Testament where Jesus prayed and got his Brit Milah (circumcision) and then his Barmitzvah.""She added, ""The disciples constantly went to the Temple Mount to pray. We have the story of Peter who healed sick people on the Temple Mount. And where the disciples and many people received the Holy Spirit on the Temple Mount. This constitutes the beginning of the Church. The Church writings are full of importance of the Temple Mount.""BIBLICAL SITE WHERE JESUS HEALED BLIND MAN EXCAVATED FOR PUBLIC VIEW: 'AFFIRMS SCRIPTURE'Heltd continued, ""It is a very deep and intimate connection for Christians to the temple. The churches in the Middle East still commemorate each year of the circumcision of Jesus on the first of January and the Barmitzvah and the healing of the sick by Peter.""  Itamar Ben-Gvir visits at Hatikva Market in Tel Aviv during his campaign ahead of the country's election, Friday, Oct. 21, 2022. Ben-Gvir is now a minister in the new Netanyahu government. (AP Photo/Oded Balilty)The Temple Mount has long been a flashpoint for tension. When as opposition leader the former Israeli Prime Minister Ariel Sharon visited the compound in 2000, the late Palestinian leader Yasser Arafat used his visit as a pretext to launch a new war of terrorism against the Jewish state called the Second Intifada, according to Israeli security experts. U.S. criticism of the visit came from U.S. Ambassador to Israel Thomas Nides, who said that the U.S. ""has been very clear in conversations with the Israeli government on the issue of preserving the status quo,"" in a statement.       Ned Price, the U.S. State Department spokesman, told reporters, ""The United States stands firmly for preservation of the historic status quo with respect to the holy sites in Jerusalem. We oppose any unilateral actions that undercut the historic status quo. They are unacceptable. The President has previously underscored the need to preserve that historic status quo at the Haram al-Sharif/Temple Mount, as has the Secretary."" Egypt’s Foreign Ministry expressed a warning about ""the negative repercussions of such measures on security and stability in the occupied territories and the region, and on the future of the peace process."" Turkey termed Ben-Gvir’s visit as being ""provocative,"" while the Palestinian Authority (PA) also condemned the visit as an ""unprecedented provocation."" The PA added that ""Netanyahu bears responsibility for this attack on Al-Aqsa.""   Former Israeli Prime Minister Ariel Sharon touches the stones of the Western Wall, also known as the Wailing Wall, as he prays while visiting the Old City Feb, 7, 2001, the morning after being elected as Israel's 39th next prime minister. Sharon as opposition leader visited the Temple Mount which led to violence among Palestinians and Israelis. (Reuters)UN ACCUSED BY ISRAELI GROUP OF FLOUTING INTERNATIONAL LAW BY FUNDING CONSTRUCTION IN ISRAELI-CONTROLLED AREAS Additional Sunni Muslim countries, with which Israel has diplomatic relations, condemned Ben-Gvir’s visit. The United Arab Emirates rebuked Ben-Gvir for his ""storming of the Al-Aqsa Mosque courtyard"" and urged an end to the ""serious and provocative violations."" Jordan blasted ""in the severest terms the storming of the Al-Aqsa Mosque and the violation of its sanctity."" The Jordanian Foreign Ministry in Amman summoned the Israeli ambassador Eitan Sorkis, who got a dressing down from the Hashemite Kingdom. It is unclear what Jordan meant by the ""storming"" of the Al-Aqsa Mosque. Ben-Gvir did not enter the mosque and his presence on the compound went without friction.  HOLY LAND FIGHT: ISRAELI LAWMAKERS CONDEMN EU'S 'ILLEGAL' ACTIONS ON BIBLICAL LAND Rabbi Abraham Cooper, the associate dean of the Los Angeles-based Jewish human rights organization, the Simon Wiesenthal Center, told Fox News Digital that Jordan is, ""The last country on earth to lecture Israel. Jordan destroyed Jewish life in the Old City in 1948."" Jordan controlled the Old City in Jerusalem from 1948 until 1967. Cooper noted that Jordan ""barred Jews for 19 years from praying at the Western Wall"" and ""it is the height of hypocrisy,"" for Jordan to lash out at Israel.   An Israeli flag flying over Jerusalem with the Temple Mount and Al-Aqsa Mosque in the distance. (iStock)The Palestinian terrorist organization Hamas, which was designated a foreign terrorist entity by the U.S. and European Union and rules the Gaza Strip, warned the ""continuation of this behavior will bring all parties closer to a big clash."" Hamas threatened a ""religious war"" against Israel in September 2022, after Jewish activists visited the Temple Mount. Rabbi Yishai Fleisher, an advisor to Ben-Gvir, told Fox News Digital, ""Freedom to pray at one's holy sites is a basic human right - and that is why Minister Ben-Gvir visited the Temple Mount today. The fact that Jews are barred from praying or condemned for ascending is racist and discriminatory. This government has shown today that it will not be held hostage to terrorist threats - and will promote the values of religious freedom and freedom of expression for all."" ISRAELI SOLDIERS DISCOVER 3,000-YEAR-OLD BIBLICAL-ERA WATCHTOWER   A Palestinian protester takes cover behind a makeshift shield during clashes with Israeli police at the Al-Aqsa Mosque compound in Jerusalem's Old City, Friday, April 22, 2022. Israeli police and Palestinian youths clashed again at a major Jerusalem holy site sacred to Jews and Muslims on Friday despite a temporary halt to Jewish visits to the site, which are seen as a provocation by the Palestinians. (AP Photo/Mahmoud Illean)The Israeli organization Beyadenu documented the number of visits in 2022 as 51,483 Jews to the site. Beyadenu said in 2021 that 34,651 Jews visited the Temple Mount.  ""There should be no discrimination against Jews visiting the Temple Mount. At the end of the day, visits are not mass prayers anyway, so it cannot be argued that they harm the status quo,"" Matan Peleg, the CEO of Im Tirtzu, told Fox News Digital. Peleg said that ""After 150 years of conflict, it is time for the Arabs to show some maturity and responsibility and stop their racist incitement, which historically has only hurt them.""   The U.N. Security Council holds a meeting on the Middle East, including the Palestinian question, Wednesday, Nov. 20, 2019 at United Nations headquarters. (AP Photo/Mary Altaffer)CLICK HERE TO GET THE FOX NEWS APP Israel does not have diplomatic relations with the Kingdom of Saudi Arabia, but Netanyahu has made it a top goal to normalize relations with Riyadh. Saudi Arabia blasted Ben-Gvir’s visit as ""provocative practices"" and said his action amounted to a ""storming ""of the Al-Aqsa courtyard. In a statement to the media, Prime Minister’s Benjamin Netanyahu’s office noted, ""Netanyahu is committed to strictly maintaining the status quo. We will be not be dictated to by Hamas. Under the status quo, ministers have gone to the Temple Mount in recent years, including (former) security minister Gilad Erdan. Therefore, the claim that a change has been made in the status quo is without foundation.""  Benjamin Weinthal reports on Israel, Iran, Syria, Turkey and Europe for Fox News Digital. Benjamin has contributed articles to The Wall Street Journal, The Jerusalem Post, Foreign Policy, Haaretz, Forbes and The New York Post. You can follow Benjamin on Twitter @BenWeinthal.",2021-03-08 02:33:00
