url,source,title,text,timestamp
https://www.foxnews.com/world/after-claim-that-possible-new-israel-govt-will-damage-relations-with-us-senator-menendez-stays-silent,fox,After claim that possible new Israel gov't will damage relations with ...," close      Video Israel's PM on Iran nuclear deal: 'We will prevent Iran from becoming a nuclear state' Israeli Prime Minister Yair Lapid discusses Israel's opposition to the current version of the Iran nuclear deal in a recent press conference.JERUSALEM, Israel — A controversial Israeli politician this week fired back at a report claiming Senate Foreign Relations Committee Chair Robert Menendez, D-N.J., said that his potential role in a new Israeli coalition government would damage U.S. relations with the Jewish state.The news website Axios reported that during a Sept. 5 meeting between Menendez and former Israeli Prime Minister Benjamin Netanyahu, the New Jersey lawmaker said he has ""serious concerns"" about a coalition government with ""extremist and polarizing individuals like [Itamar] Ben-Gvir."" Israelis go to the polls next month.According to the Axios article, a source said, ""People who were in the room saw how p---ed off Bibi [Netanyahu] got"" in response to Menendez’s comments.The controversial far-right Israeli politician in question is Itamar Ben-Gvir. His party has been gaining in the polls and could finish as high as third or fourth place in the upcoming election.ISRAEL CALLS FOR NEW ELECTIONS ONE MONTH BEFORE BIDEN VISIT  Sen. Robert Menendez, D-N.J. (AP)In a statement to Fox News Digital, Ben-Gvir, the leader of the Otzma Yehudit (Jewish Strength) party said, ""I am deeply concerned by reports that Senator Menendez has aimed incorrect and mistaken criticisms at the millions of Israelis who will soon vote in favor of a center-right government and me personally.""He continued, ""Everyone knows that the senator is a true friend of Israel and a champion of the U.S.-Israel relationship, and more importantly, he is a man of integrity. Therefore, my sense is that he would not have made the statements reported had he been correctly informed of the positions I hold, as well as those I do not hold.""Ben-Gvir has faced criticism for tearing the Cadillac emblem off of Yitzhak Rabin the then-Israeli prime minister’s car in 1995 and stating, ""We reached Rabin’s car, we will get to Rabin, too."" Israeli extremist Yigal Amir, then 25, assassinated Rabin in the same year.Critics have painted Ben-Gvir as a right-wing extremist for his connections and support of far right-wing elements in Israel, including the late Rabbi Meir Kahane whose ultra-nationalist party was outlawed from running in subsequent elections for inciting racism against Arabs. Kahane was assassinated by a terrorist in Manhattan in 1990.In a recent interview with the Associated Press Shuki Friedman, an expert on Israel’s far right described Ben-Gvir as being ""a populist demagogue … he interviews well, he is good on camera, and he has had plenty of screen time that has given him legitimacy,"" noted Friedman of the Jewish People Policy Institute. ISRAEL, LEBANON INCH CLOSER TO RESOLVE MARITIME DISPUTE AS TERROR GROUP THREATENS OVER DRILLING  Israeli right-wing Knesset member Itamar Ben-Gvir in Jerusalem. (Mostafa Alkharouf/Anadolu Agency via Getty Images) Ben-Gvir told Fox News Digital, ""The enemies of a strong Israel besmirch me, calling me and my party racist. But the truth is that we are anti-racist; we are fighting against the racist antisemitism fomenting within the boundaries of our homeland. We believe that Israel needs to uproot terror organizations such as Hamas, Islamic Jihad and Al-Aqsa Martyrs’ Brigades, just as the United States defeated al Qaeda. Like millions of Americans, we believe that peace comes through strength and that Israel’s policies should be based upon the firm enforcement of our right to sovereignty and self-defense.""In response to the warnings from Menendez, Netanyahu said at a press conference last week in Tel Aviv, ""I would have expected them to warn us of a government that depends on the Muslim Brotherhood who support terrorism and Ahmad Tibi and Ayman Odeh. Odeh said that [Hassan] Nasrallah (Hezbollah) is a hero, after that is it any wonder that Lapid ran to sell him the gas of the citizens of Israel?""Netanyahu was referring to Israeli Prime Minister Yair Lapid who is the midst of working through a controversial gas deal with Lebanon. Ahmed Tibi and Ayman Odeh are Israeli Arab politicians.A spokesperson for Menendez declined to comment in response to a Fox News Digital press query. The U.S. State Department did not answer a media query.However, Rep. Brad Sherman, D-Calif., who is considered pro-Israel, tweeted, ""As Israel heads toward another election in November, I urge Israeli political leaders from all sides of the political spectrum to ostracize extremists like Ben-Gvir whose outrageous views run contrary to Israel’s core principles of a democratic and Jewish state.""While supporters of Ben-Gvir claim he has reformed his ways, his appeal has not spilled over into the center of Israeli politics, according to professor Tamar Hermann, a senior researcher for the Israeli Democracy Institute. ""He [Ben-Gvir] is still a pariah in the center [and] on the left."" Hermann also noted that he was legitimized by Netanyahu and other politicians on the right.  Israeli Prime Minister Yair Lapid speaks to supporters during the party's opening election campaign rally on Aug. 3, 2022, in Tel Aviv. (Amir Levy/Getty Images) Hermann said Netanyahu helped to mainstream Ben-Gvir during the last election by pushing the idea that ""this man can become a member of the Knesset,"" and this legitimization by the former prime minister was ""critical in the eyes of all people who vote."" ""Ben-Gvir is not at the far end of Israeli politics because of the radicalization that has happened"" after May 2021, said Hermann.During May 2021, Hamas terrorists launched rockets into the Jewish state while Arabs rioted in Israeli cities, which included arson attacks on synagogues. According to Hermann, the events of May 2021 sparked a radicalization among Israeli Arabs and Israeli Jews.RIOTS ERUPT IN PARTS OF ISRAEL AS TENSIONS FLAREBen-Gvir has significant support among the ultra-orthodox, mainly Sephardi voters, who are ""very enthusiastic"" about his message that ""appeals to chauvinistic views of Jews in the state of Israel,"" said Hermann. ""They are looking for a strong leader.""In late August polls from Israel's three major TV networks revealed that Ben-Gvir's party could secure between eight and nine seats in Israel's parliament if elections were conducted straight away. The dramatic rise of Ben-Gvir in the election process has not rolled back since the August poll, according to Israeli public opinion experts like Hermann.Bezalel Smotrich, the chief of the Religious Zionist Party, which formed a voting block with Ben-Gvir, told the Israeli media that Ben-Gvir has positioned himself to be a senior minister in the next government.""I hope we will be the third-largest party in the state of Israel,"" said Smotrich.  An election campaign poster in 2021 for far-right Otzma Yehudit (Jewish Power) with images of party leader Itamar Ben-Gvir behind Benjamin Netanyahu, the former Israeli prime minister. (Artur Widak/NurPhoto via Getty Images) When asked about the reported row Yishai Fleisher, Ben-Gvir's spokesman for English-speaking media told Fox News Digital, ""I think a strong, Jewish, proud, national, patriotic Israel is good for the U.S.-Israel relationship. Everybody understands the challenges of jihadism and erosion of national identity. That is what Ben-Gvir represents, and the people of Israel think that way.""CLICK HERE TO GET THE FOX NEWS APPFleisher said Menendez’s concerns are not justified: ""Moreover, it does not feel quite right that there is this air of meddling. What will help is mutual support, mutual trust and mutual respect for each other’s democratic processes. Just like Israel wants to see a strong U.S., I am sure the American people want to see a strong Israel.""Fleisher who is also spokesman for the Jewish community of Hebron, a city close to where Ben Gvir resides, also said that his candidate had later apologized for the Rabin incident, adding that Ben-Gvir has matured.The Associated Press contributed to this report.   Benjamin Weinthal reports on Israel, Iran, Syria, Turkey and Europe for Fox News Digital. Benjamin has contributed articles to The Wall Street Journal, The Jerusalem Post, Foreign Policy, Haaretz, Forbes and The New York Post. You can follow Benjamin on Twitter @BenWeinthal.",2021-03-08 02:33:00
https://www.foxnews.com/media/benjamin-netanyahu-warns-against-new-nuclear-deal-iran,fox,Benjamin Netanyahu warns against a new nuclear deal with Iran ...," close      Video Benjamin Netanyahu on Iran reportedly aiding Russian drone strikes in Ukraine Former Israeli Prime Minister Benjamin Netanyahu says it's time for everyone to take a stand against the Iranian regime on 'One Nation with Brian Kilmeade.'Former Israeli Prime Minister Benjamin Netanyahu addressed reports of Iran helping Russia launch drone strikes in Ukraine and spoke out against a new Iran nuclear deal on Saturday's ""One Nation with Brian Kilmeade.""BENJAMIN NETANYAHU: I'll tell you, the one thing that I would say is, those who advocate a deal with a nuclear Iran, a nuclear deal with Iran, can have a taste of what's in store. And we're getting that taste anyway. You can see the brave men and women of Iran, the brave women of Iran that are going into the streets against these goons of this Islamic terrorist state, and they're facing up to them. You're going to give the ayatollahs nuclear weapons, you're going to give them a deal that will give them hundreds of billions of dollars so they can make more of these deadly drones to attack, ultimately Israelis, Americans and others? You don't want that. CLICK HERE TO GET THE FOX NEWS APP…I think it's time that everyone took a stand against the Iranian regime. When I put out videos reaching out to Iran, to the Iranian people, I got an enormous amount of responses with names, addresses, and I said to our intel guys, I said, ""Something's wrong here. It can't be. I mean, these people are risking their lives."" And they came back to me, they said, ""Prime minister, they are, because they're really, really bent on having freedom."" So I think you see that now. Will it work in the end? I think we can help it work. I think there are many things that if I come back into office in two weeks, I'll help them work. BIDEN SEEMS SYMPATHETIC TO ISRAEL, BUT POLICIES ON IRAN, PALESTINIANS CREATE MISDIRECTION: BENJAMIN NETANYAHUWATCH THE FULL SEGMENT BELOW:  Video  ",2021-03-08 02:33:00
https://www.foxnews.com/world/israel-announces-maritime-border-deal-lebanon,fox,Israel announces maritime border deal with Lebanon | Fox News," close      Video Fox News Flash top headlines for October 11 Fox News Flash top headlines are here. Check out what's clicking on Foxnews.com.Israel’s prime minister said Tuesday that the country has reached a ""historic agreement"" with neighboring Lebanon over their shared maritime border after months of U.S.-brokered negotiations.The agreement, coming after several years of U.S.-mediated talks, would mark a major breakthrough in relations with the two countries, which formally have been at war since Israel's establishment in 1948. But the deal still faces some obstacles, including key legal and political challenges in Israel. There was no immediate confirmation by Lebanon that a deal had been reached.At stake are rights over exploiting undersea natural gas reserves in areas of the eastern Mediterranean that the two countries — which do not have diplomatic relations — claim.Premier Yair Lapid called the deal an ""historic achievement that will strengthen Israel’s security, inject billions into Israel’s economy, and ensure the stability of our northern border.""   In this photo released by Lebanon's official government photographer Dalati Nohra, Lebanese Prime Minister Najib Makati, right, receives the final draft of the maritime border agreement between Lebanon and Israel from his deputy Elias Bou Saab who leads the Lebanese negotiating team, in Beirut, Lebanon, Tuesday, Oct. 11, 2022. (Dalati Nohra via AP)3 PALESTINIANS ARRESTED FOLLOWING DEADLY ATTACK ON ISRAELI SECURITY CHECKPOINT, MANHUNT ON GOINGThe agreement is expected to enable additional natural gas production in the Mediterranean. Lebanon hopes gas exploration will help lift its country out of its spiraling economic crisis.Lebanon and Israel both claim some 860 square kilometers (330 square miles) of the Mediterranean Sea. Under the agreement, those waters would be divided along a line straddling a strategic natural gas field.According to a senior Israeli official, Lebanon would be allowed to produce gas from that field, called ""Qana,"" but pay royalties to Israel for any gas produced from the Israeli side. Lebanon has been working with the French energy giant Total on preparations for exploring the field.The agreement would also leave in place an existing ""buoy line"" that serves as a de facto border between the two countries, the official said. He spoke on condition of anonymity because he was discussing behind-the-scenes negotiations.ISRAEL CLEARS ITSELF IN 7-YEAR-OLD PALESTINIAN BOY'S DEATHMany leading security figures, both active and retired, have hailed the deal because it could lower tensions with Lebanon's Hezbollah militant group, which has repeatedly threatened to strike Israeli natural gas assets in the Mediterranean.With Lebanon now having a stake in the region's natural gas industry, experts believe the sides will think twice before opening up another war.The two sides fought a monthlong war in 2006, and Israel considers the heavily armed Hezbollah to be its most immediate military threat.""It might help create and strengthen the mutual deterrence between Israel and Hezbollah,"" said Yoel Guzansky, a senior fellow at Israel's Institute for National Security Studies. ""This is a very positive thing for Israel.""The final draft of the agreement will be brought before Israel’s caretaker government for approval this week ahead of the Nov. 1 election, when the country goes to the polls for the fifth time in under four years.  In this photo released by Lebanon's official government photographer Dalati Nohra, Lebanese President Michel Aoun, left, receives the final draft of the maritime border agreement between Lebanon and Israel from the deputy of Lebanese prime minister Elias Bou Saab and who leads the Lebanese negotiations, in Beirut, Lebanon, Tuesday, Oct. 11, 2022. (Dalati Nohra via AP)2 PALESTINIANS KILLED BY ISRAEL MILITARY IN WEST BANKAn Israeli official said the deal would go before Israel’s Security Cabinet and then the full Cabinet on Wednesday and be presented to Parliament for a 14-day review. After the review, the Cabinet would reconvene to give final, formal approval, the official said, speaking on condition of anonymity to discuss government policy.The process will take place less than three weeks before Israel goes to the polls Nov. 1 for the fifth time in under four years.Approval is not guaranteed. Former Prime Minister Benjamin Netanyahu, has said the caretaker government has no authority to sign such an important agreement and has vowed to cancel the deal if re-elected. On Tuesday, he accused Lapid of caving in to Hezbollah threats.""This is not a historic agreement. It's a historic surrender,"" Netanyahu said in a Facebook video.The Kohelet Policy Forum, an influential conservative think tank, already has filed a challenge to the Supreme Court trying to block the deal.  FILE - Israeli Prime Minister Yair Lapid makes an opening statement as he chairs the weekly cabinet meeting in Jerusalem, Oct. 2, 2022. (Dalati Nohra via AP)ISRAEL, LEBANON INCH CLOSER TO RESOLVE MARITIME DISPUTE AS TERROR GROUP THREATENS OVER DRILLINGEugene Kontorovich, the forum's director of international law, claimed the agreement requires parliamentary approval. He accused the government of trying to rush through an agreement under pressure from Hezbollah. ""This means Hezbollah now overrides Israel's democracy,"" he said.But Yuval Shany, an expert on international law at the Israel Democracy Institute, another prominent think tank, said it is customary, but not mandatory, to seek Knesset approval for such agreements.""Peace agreements are usually brought to the Knesset, but this is not a peace agreement. It's a border and limitation agreement,"" he said.Senior U.S. energy envoy Amos Hochstein, whom Washington appointed a year ago to mediate talks, delivered a modified proposal of the maritime border deal to lead Lebanese negotiator, Deputy Speaker Elias Bou Saab late Monday night, according to local media and officials.CLICK HERE TO GET THE FOX NEWS APPPresident Michel Aoun’s office said the latest version of the proposal ""satisfies Lebanon, meets its demands, and preserves its rights to its natural resources,"" and will hold consultations with officials before making an announcement. Hezbollah did not immediately comment, but its leader, Hassan Nasrallah, has said that the group would endorse the Lebanese government’s position. In the past, however, he has threatened to use its weapons to protect Lebanon’s economic rights.Nasrallah was expected to make an official statement later Tuesday.  ",2021-03-08 02:33:00
https://www.foxnews.com/world/netanyahu-victory-israeli-election-presents-stark-challenge-us-middle-east-policy,fox,Netanyahu victory in Israeli election presents 'stark challenge' for US ...," close      Video Netanyahu on campaign trail in Israel Benjamin Netanyahu's Likud party was the biggest vote-getter in Israel's election on Nov. 1, 2022. He now has to work on cobbling together a coalition with right-wing and religious parties. (Ariel Tanaami/TPS)Benjamin Netanyahu’s win in Israel’s latest election has drawn a muted response from the U.S. as policymakers wrestle with the implications for foreign policy in the Middle East.Sitting Prime Minister Yair Lapid on Thursday conceded the election to Netanyahu after it became clear the former prime minister’s coalition would allow him to regain his seat as leader of the country.But Netanyahu’s win occurs while President Joe Biden sits in the White House, presenting a somewhat awkward matchup of ideals and policy aims from the U.S. and Israel.NETANYAHU LOOKS SET TO RETURN TO POWER IN ISRAEL AFTER FIFTH ELECTIONSen. Ted Cruz, R-Texas, was the first U.S. politician to congratulate Netanyahu on his victory, writing in a tweet that Israel had a ""robust"" turnout and the people made the ""clear choice"" to re-elect Netanyahu.And Cruz told Fox News Digital that Congress can and should act to ensure that Israel and the U.S. remain in-step on key issues, such as maritime borders and territorial integrity.  Benjamin Netanyahu addresses the audience in Bnei Brak, Israel, on Oct. 29, 2022. (Amir Levy/Getty Images)""The Israeli people have made a clear choice for Benjamin Netanyahu to once again lead their country and form a government,"" Cruz said. ""Unfortunately, the Biden administration has spent the last two years pressuring and undermining our Israeli allies — including most recently to cede maritime territory to Hezbollah.""""There’s no doubt they will now try increase that pressure,"" Cruz continued. ""Congress can and will provide aggressive oversight to ensure that doesn't happen and to preserve the bonds of the US-Israel relationship.""UN COMMITTEE VOTES FOR ISRAEL TO DISPOSE OF NUCLEAR WEAPONS, ALLOW INTERNATIONAL INSPECTORSThe statement was a stark contrast to those put out by U.S. Ambassador to Israel Thomas Nides and the White House, which echoed the same statement that they were ""pleased to see such strong voter turnout for the Knesset election"" but that it was ""too early to speculate on the exact composition of the next government coalition until all the votes are counted.""Nides later revealed he had a call with Netanyahu in which Nides ""congratulated him on his victory and told him I look forward to working together to maintain the unbreakable bond.""  FILE - Israeli Prime Minister Yair Lapid attends a cabinet meeting at the prime minister's office in Jerusalem, Sunday, Oct. 23, 2022. Israel is holding its fifth national election in under four years, and once again the race is shaping up as a referendum on former Prime Minister Benjamin Netanyahu’s fitness to rule.  (Abir Sultan/Pool Photo via AP, File) ( (Abir Sultan/Pool Photo via AP, File))Meanwhile, Hungarian Prime Minister Viktor Orban posted a picture of himself with Netanyahu’s new book, ""Bibi: My Story,"" and wrote, ""What a great victory for Benjamin Netanyahu in Israel! Hard times require strong leaders. Welcome back!""Also adding congratulations was new Italian Prime Minister Giorgia Meloni who tweeted ""Congratulations - Mazel Tov to @netanyahu for the electoral success. Ready to strengthen our friendship and our bilateral relations, to better face our common challenges.""WATCH: BIBI ‘EYE TO EYE’ WITH TRUMP, ‘DIVERGED’ WITH OBAMA ON PEACE AND POWER, TOUTS ‘SHARING VALUES’ WITH USIsrael and Lebanon only last month agreed to a new deal on their shared maritime border that would see the nations share the rights to undersea natural gas reserves in the eastern Mediterranean.Lapid has called the deal a ""historic achievement that will strengthen Israel’s security, inject billions into Israel’s economy and ensure the stability of our northern border,"" but Netanyahu has promised to ""neutralize"" the deal if his party regained control in November.  President Joe Biden shakes hands with Benjamin Netanyahu during a recent visit to Israel. (Gideon Marcowicz/TPS)State Department spokesperson Ned Price on Wednesday said the U.S. will stand by the deal, which it worked for several years to help broker, and he urged all Israeli government officials to ""continue to share the values of open democratic society.""""Because it was in the interests of both countries, it was in the profound interest of the United States,"" Price said of the deal. ""We seek to see a more stable, a more integrated region, and this maritime border – the agreement regarding it – helps to advance that.""WATCH: PUTIN STANDS TO REAP BENEFITS OF IRAN NUCLEAR DEAL WITH US, NETANYAHU SAYSThe possible more far-right composition of the Israeli government – which would see Otzma Yehudit party leader Itamar Ben-Gvir attain a prominent role – has already prompted concern among more left-leaning administrations. Two officials told Axios that the Biden administration is ""unlikely"" to engage with Ben-Gvir, whom they labeled a ""Jewish supremacist."" Ben-Gvir has said he wants to be minister of internal security, giving him charge over the police and policies around holy sites in Jerusalem.  Israeli far-right lawmaker Itamar Ben-Gvir is likely to become a minister in a new Netanyahu government following a successful election. (AP Photo/Oded Balilty)""Because of the likely makeup of the next Netanyahu government, some stark challenges for American national security will present themselves quickly,"" Joel Rubin, a former deputy assistant secretary of state under former President Barack Obama, told Fox News Digital.Rubin said that Netanyahu’s work on the Abraham Accords, which saw Israel create four peace deals with individual nations in the Middle East, would face ""immediate stress"" with a ""more right-leaning"" approach to ""the Palestinian issue.""""These countries, especially the UAE (United Arab Emirates), have already voiced concerns about an Israel that is more right-leaning on the Palestinian issue, as well as concerns about members of his potential cabinet having in the past used hostile language about Arabs,"" Rubin explained. ""The Biden administration will be challenged to navigate this space, which will require close coordination with Netanyahu himself, personally, as he attempts to manage a challenging governing coalition for Israeli-Arab relations.""CLICK HERE TO GET THE FOX NEWS APP""A failure to protect these budding relationships will raise the risk of conflict in the region, never a good outcome for anyone’s security, including the United States,"" he added.Netanyahu in a recent interview with Fox News Digital said that he believed that Arab nations ""lost their interest"" in the Palestinian question ""a long time ago,"" which is what ""facilitated the Abraham Accords.""  Peter Aitken is a Fox News Digital reporter with a focus on national and global news. ",2021-03-08 02:33:00
