url,source,title,text,timestamp
https://www.foxnews.com/world/israel-announces-new-settler-homes-in-the-west-bank,fox,Israel announces new settlement homes in the West Bank | Fox News," close      Video Fox News Flash top headlines for January 10 Fox News Flash top headlines are here. Check out what's clicking on Foxnews.com.Israeli Prime Minister Benjamin Netanyahu announced Monday the construction of some 800 housing units in the Jewish settlements in the West Bank — just days before U.S. President-elect Joe Biden’s inauguration.According to a statement issued by the prime minister's office, among the units approved would be 100 new homes for the Tal Menashe settlement, where Ester Horgan, a 53-year-old mother of six, was murdered by a Palestinian assailant last month while jogging in a nearby forest.The new plan includes the legalization of an outpost.EX-ISRAELI AMBASSADOR DANON'S BIG IDEA: BIDEN SHOULD MAINTAIN STRONG STANCE ON IRAN, PARTNER WITH ALLIESIsraeli media outlet Kann reported that alternate Prime Minister and Defense Minister Benny Gantz has instructed the Defense Ministry panel to convene next week to green-light construction.  Israeli Prime Minister Benjamin Netanyahu speaks during a briefing on coronavirus development in Israel at his office in Jerusalem, Sunday, Sept. 13 2020. (Alex Kolomiensky/Yedioth Ahronoth via AP, Pool) It was not immediately clear how soon the homes would be built, as such construction usually requires approval from several government bodies and a tendering process.The move has stirred criticism from the opposing parties, such as Yair Lapid, the leader of centrist Yesh Atid political party, who called the move ""irresponsible"" and said it would cause an unnecessary conflict with the Biden administration.""The Biden administration has not yet taken office and the government. A sane government does not start an unnecessary battle with a new American President,"" Lapid tweeted.Israeli left-wing organization ""Peace Now"" said Netanyahu's announcement signals to the Biden administration that ""Israel wants a confrontation.""CONVICTED SPY WHO SOLD US MILITARY SECRETS ARRIVES IN ISRAEL, GRANTED CITIZENSHIPThe Trump administration has been openly supportive of Netanyahu's policy regarding the West Bank's Jewish settlements.Earlier Monday, the U.S. ambassador to Israel, David M. Friedman, visited the Knesset – Israel’s legislative branch – at the invitation of the Subcommittee for Policy and Strategy of the Foreign Affairs and Defense Committee. During the closed-door meeting, the ambassador referred to the issue and called it one of his most significant accomplishments.""We succeeded together and making it stronger than ever before, making our nations more secure, more peaceful and more prosperous,"" he said. ""And people, as my friends put down the list of some of the accomplishments, whether it recognized the capital of Israel Jerusalem, to sovereignty over the Golan Heights, to the non-illegality, if you will, of communities in Yehuda Veshomron"".  In this Nov. 16, 2020 file photo, workers take a break before European Union officials visit the construction site for Givat Hamatos settlement in Jerusalem. Israel on Monday, Jan. 12, 2021, advanced plans to build 800 new settler homes in the occupied West Bank, a move that could strain ties with the incoming administration of President-elect Joe Biden. Prime Minister Benjamin Netanyahu's office announced the move, saying it would include 100 homes in a settlement where an Israeli woman was killed recently in an alleged terror attack. (AP Photo/Maya Alleruzzo, File) As described in the Biden-Harris website, the Biden administration is expected to adopt a no-tolerance approach with Israel.""Biden opposes any unilateral steps by either side that undermine a two-state solution,"" the website said. ""He opposes annexation and settlement expansion and will continue to oppose both as President.""CLICK HERE TO GET THE FOX NEWS APPIsrael captured the West Bank and east Jerusalem in the 1967 war, territories the Palestinians want for their future state. Nearly 500,000 Israelis live in settlements scattered across the West Bank. The Palestinians view settlements as a violation of international law and an obstacle to peace, a position with wide international support.Israel will hold its fourth round of elections in two years in March, and this decision by Netanyahu is expected to strengthen his support from the right wing citizens and the settlers, which would secure his next term.  ",2021-03-08 02:33:00
https://www.foxnews.com/world/israel-netanyahu-pleads-not-guilty-corruption-trial,fox,Israeli PM Netanyahu pleads not guilty to corruption charges as trial ...," close      Video Fox News Flash top headlines for February 8 Fox News Flash top headlines are here. Check out what's clicking on Foxnews.com.JERUSALEM – Israeli Prime Minister Benjamin Netanyahu pleaded not guilty on Monday as his trial on corruption charges resumed in a Jerusalem courtroom just weeks before national elections in which he hopes to extend his 12-year rule.Netanyahu was indicted last year for fraud, breach of trust and accepting bribes in three separate cases. In recent months, Israelis have held weekly protests calling on him to resign over the charges and criticizing his government's response to the coronavirus crisis. Protesters gathered outside the courthouse could be heard inside the room where the hearing was being held.NIKKI HALEY ACCUSED BIDEN OF 'SNUBBING' ISRAEL, 'COZYING UP' TO IRAN: 'I REALLY DON'T UNDERSTAND THE LOGICHe stands accused of accepting lavish gifts from wealthy friends and offering to grant favors to powerful media moguls in exchange for favorable coverage of him and his family. The latest hearing was postponed last month due to lockdown restrictions on public gatherings.Israel’s longest-serving leader is also the first sitting prime minister to go on trial for corruption. Israeli law requires Cabinet ministers to resign when charged with criminal offenses, but does not specifically address the case of a prime minister under indictment.  Israeli Prime Minister Benjamin Netanyahu stands at a hearing at the district court in Jerusalem, Monday, Feb. 8, 2021. (AP Photo/Reuven Castro, Pool) Netanyahu has denied any wrongdoing and has dismissed the charges against him as a ""witch-hunt"" orchestrated by biased law enforcement and media. He has refused to step down and has used his office as a bully pulpit against critics and the criminal justice system.At Monday's hearing, Netanyahu's lawyers submitted a written response pleading not guilty. They then argued against the cases on procedural grounds, saying the attorney general had not properly approved the investigations in writing.After around 20 minutes, Netanyahu left the courtroom without explanation and his motorcade departed.The hearing continued in his absence, with his lawyers arguing for more than an hour that constitutional procedures had not been followed. The judges appeared skeptical and repeatedly called on the defense lawyers to wrap it up. The prosecution then rejected those arguments, saying the attorney general had approved the investigations in dozens of meetings.Outside the courthouse, around 150 protesters chanted against Netanyahu. Many carried banners reading ""Crime Minister.""  Protesters, including one wearing a mask depicting Israeli Prime Minister Benjamin Netanyahu, gather outside the District Court during a hearing in his corruption trial, in Jerusalem, Monday, Feb. 8, 2021. (AP Photo/Maya Alleruzzo) ""We want a new government, a clean government, no corruption"" said Sharon Sagy, a protester, ""We don’t want Bibi Netanyahu, we want him to go, he needs to go,"" she said, using his nickname.At the start of his trial last May, Netanyahu was flanked by a cohort of Likud party allies as he railed against the media, police, judges and prosecutors. He said the trial aimed to ""depose a strong, right-wing prime minister, and thus remove the nationalist camp from the leadership of the country for many years.""BIDEN ADMINISTRATION LIKELY GOING BACK TO 'GOOD OLD DAYS' OF IRAN NUCLEAR DEAL: MCFARLANDNetanyahu has served as Israel's prime minister since 2009, and in the past two years has managed to hang onto power through three tumultuous, deadlocked elections. His flimsy ruling coalition collapsed in December, and he now faces a major battle for reelection in March 23 parliamentary elections.Netanyahu hopes to campaign on having pulled the country out of the pandemic through one of the world's most successful vaccination campaigns. He boasts of having personally secured millions of doses from major drug makers, allowing Israel to vaccinate more than a third of its population of 9.3 million. He hopes to vaccinate the entire adult population by late March.  Israeli Prime Minister Benjamin Netanyahu looks on prior to a hearing at the district court in Jerusalem, Monday, Feb. 8, 2021. (AP Photo/Reuven Castro, Pool) But his government has faced heavy criticism for other aspects of its response to the crisis. The country is only now starting to emerge from its third nationwide lockdown, and the closures have sent unemployment skyrocketing.An emergency government formed last May to combat the coronavirus outbreak has been mired in bickering. The country's leaders have struggled to enact consistent policies and repeatedly accused each other of playing politics with the pandemic. Israel has meanwhile reported nearly 700,000 cases since the outbreak began, including 5,121 deaths.CLICK HERE TO GET THE FOX NEWS APPOne major controversy concerns Israel's ultra-Orthodox Jewish community, many of whom have openly flouted restrictions on public gatherings. Netanyahu will need the ultra-Orthodox parties to form a ruling coalition, and his critics accuse him of turning a blind eye to their violations.Polls show Netanyahu's Likud winning the most seats but struggling to form a 61-seat majority coalition in the Knesset, Israel's parliament. The margin of victory could be extremely tight, potentially allowing a small, fringe party to decide who heads the next government.  ",2021-03-08 02:33:00
https://www.foxnews.com/politics/biden-netanyahu-warm-friendly-talk,fox,"Biden, Israeli PM Netanyahu have 'warm and friendly' talk | Fox News"," close      Video Benjamin Netanyahu: Trump is the 'best friend Israel has ever had in White House' President Biden spoke with Israeli Prime Minister Benjamin Netanyahu on Wednesday, Netanyahu’s office confirmed to Fox News.Netanyahu’s office characterized the call as ""warm and friendly"" and said that it lasted for roughly an hour. ""The leaders noted their personal relations of years, and said they would act together to continue to strengthen the alliance between Israel and the U.S.,"" the statement from Netanyahu’s office said.Among the topics that were said to be discussed were promoting peace agreements, challenges in the region – including the Iranian threat – and the COVID-19 crisis.VP KAMALA HARRIS HOLDS CALLS WITH FOREIGN LEADERS WITHOUT BIDEN White House Press Secretary Jen Psaki sought to reassure reporters this week that Israel was an ""ally"" of the U.S., after the administration fielded questions as to why Biden had not yet spoken with the Israeli leader.Some wondered whether it was a snub, considering Biden had called leaders like Canadian Prime Minister Justin Trudeau and Mexico's President Andrés Manuel López Obrador the week he was inaugurated.CLICK HERE FOR THE FOX NEWS APPDonald Trump fostered an incredibly warm relationship with Israel and Netanyahu. During an interview with Fox News last year Netanyahu called Trump the ""best friend that Israel has ever had in the White House.""  ",2021-03-08 02:33:00
https://www.foxnews.com/politics/psaki-biden-netanyahu-israel-important-ally,fox,Psaki says Biden will speak with Netanyahu 'soon' after 3 weeks ...," close      Video Biden will have call 'soon' with 'important' ally Israel: White House White House press secretary Jen Psaki says President Biden's first call to a leader in the Middle East region will be to Prime Minister Benjamin Netanyahu.White House press secretary Jen Psaki said that President Biden would call Prime Minister Benjamin Netanyahu ""soon,"" downplaying concerns that the new administration could be shutting out the Israeli leader.""His first call with a leader in the region will be with Prime Minister Netanyahu,"" Psaki told reporters Tuesday. ""It will be soon. Stay tuned. Israel is an important ally."" Israeli pundits question the message Biden is sending in not making contact with Netanyahu nearly a month into the administration.The new president has already made a flurry of phone calls to American friends around the world, including leaders in Canada, Britain, France, Japan, Mexico, Germany, South Korea, and even some foes: He spoke with Chinese President Xi Jinping and Russia’s Vladimir Putin. Former President Trump called Netanyahu two days into office. The U.S. is Israel’s closest ally, providing about $3.8 billion in annual military aid and shielding it from censure in international forums over its policies toward the Palestinians.WHITE HOUSE DECLINES TO SAY WHETHER ISRAEL IS AN 'IMPORTANT' ALLY Last week, Israel’s former ambassador to the United Nations Danny Danon tweeted a list of 10 countries that he said had gotten a call from Biden. ""Might it now be time to call the leader of #Israel, the closest ally of the #US?"" Danon posted. Psaki at the time promised the president’s silence was ""not an intentional diss.""""Israel is of course an ally,"" Psaki says. ""Israel is a country where we have an important strategic security relationship and our team is fully engaged.""Netanyahu, who faces a tough reelection battle in March, has long touted his close relationship with world leaders. Biden ""is making calls to world leaders according to the order he sees fit,"" he said. ""The Israel-U.S. alliance is strong and so is our friendship of almost 40 years, though we may not agree on everything,"" Netanyahu said, unconcerned. He said that Biden had more pressing priorities to contend with, such as fallout for the coronavirus pandemic. Former President Trump’s Israel policy was in lockstep with Netanyahu, but the Israeli leader could have a frostier relationship with Biden. The Biden administration plans to leave the U.S. embassy in Jerusalem, a controversial priority for the Trump administration, but already Secretary of State Antony Blinken suggested the U.S. would not adhere to Trump’s recognition of Israeli sovereignty over the Golan Heights, a strategic region captured from Syria in 1967. NETANYAHU PLEADS NOT GUILTY TO CORRUPTION CHARGES Biden, a former chairman of the Senate Foreign Relations Committee, has known Netanyahu for decades, once affectionately writing in an autograph for the prime minister: ""Bibi, I don't agree with a damn thing you say but I love you.""Their relationship was tested when in 2010 Biden first visited Israel as vice president. Hours after he touched down in Tel Aviv, the Israeli government announced it was adding 1,600 housing units for Jews to an east Jerusalem settlement. Biden condemned the move as  ""precisely the kind of step that undermines the trust we need right now,"" but Netanyahu's allies said he'd been blindsided by the announcement from his interior minister. Netanyahu was an outspoken critic of the Iran nuclear deal under the Obama administration while Biden was vice president. After Trump did away with the deal, the Biden White House has said Iran must make the first move to return to compliance and stop enriching uranium for a new deal to be reached. CLICK HERE FOR THE FOX NEWS APPBiden's team has made clear he would consult with Israel before drawing up the deal again, though Netanyahu is expected to remain in opposition to the deal. The Associated Press contributed to this report.   ",2021-03-08 02:33:00
https://www.foxnews.com/world/israels-netanyahu-blames-iran-for-cargo-ship-attack,fox,Israel's Netanyahu blames Iran for cargo ship attack | Fox News," close      Video US airstrike to sent 'unambiguous message' to Iran: White House FOX News White House correspondent Peter Doocy has the details on 'Special Report'Israeli Prime Minister Benjamin Netanyahu on Monday accused Iran of attacking an Israeli-owned ship in the Gulf of Oman last week, a mysterious explosion that further spiked security concerns in the region. Without offering any evidence to his claim, Netanyahu told Israeli public broadcaster Kan that ""it was indeed an act by Iran, that’s clear."" ""Iran is the greatest enemy of Israel, I am determined to halt it. We are hitting it in the entire region,"" Netanyahu said. Iran promptly dismissed the charges.   In this August 2020, photo, the vehicle cargo ship Helios Ray is seen at the Port of Chiba in Chiba, Japan. An explosion struck the Israeli-owned Helios Ray as it sailed out of the Middle East on Friday. (AP) IRAN REJECTS OFFER OF DIRECT US NUCLEAR TALKS, SENIOR DIPLOMATS SAY The blast struck the Israeli-owned MV Helios Ray, a Bahamian-flagged roll-on, roll-off vehicle cargo ship, as it was sailing out of the Middle East on its way to Singapore on Friday. The crew was unharmed, but the vessel sustained two holes on its port side and two on its starboard side just above the waterline, according to American defense officials. The ship came to Dubai’s port for repairs on Sunday, days after the blast that revived security concerns in Mideast waterways amid heightened tensions with Iran. Iran has sought to pressure the U.S. to lift sanctions on Tehran as President Joe Biden's administration considers options for returning to negotiations with Iran over its nuclear program. Biden has said repeatedly the U.S. would return to the nuclear deal between Tehran and world powers that his predecessor, Donald Trump, withdrew from in 2018 only after Iran restores its full compliance with the accord. The explosion on the Israeli-owned ship last week recalled the tense summer of 2019, when the U.S. military accused Iran of attacking several oil tankers in the Gulf of Oman with limpet mines, designed to be attached magnetically to a ship’s hull. The Gulf of Oman leads through the narrow Strait of Hormuz, a vital passage for the world’s oil supplies. Tehran has denied the accusations that it was behind the limpet mine attacks.   US airstrike on Iran-backed forces in Syria was 'good call': Keane Fox News senior strategic analyst Gen. Jack Keane breaks down the Biden administration's first known military action.POMPEO SAYS BIDEN’S MOVES ON IRAN, HOUTHIS PRECURSORS TO RE-ENTERING ‘CRAZY, CRAPPY’ NUCLEAR DEAL It remains unclear what caused Friday's blast on the Helios Ray. The vessel had discharged cars at various ports in the Persian Gulf before the explosion forced it to reverse course. Over the weekend, Israel’s defense minister and army chief had both indicated they held Iran responsible for what they said was an attack on the vessel. Iran responded to Netanyahu's statement saying it ""strongly rejected"" the claim that it was behind the attack. In a press briefing, Foreign Ministry spokesman Saeed Khatibzadeh said Netanyahu was ""suffering from an obsession with Iran"" and described his charges as ""fear-mongering."" Khatibzadeh also accused Israel of taking ""suspicious actions in the region"" against Iran in recent months to undermine the 2015 nuclear deal, without elaborating, and vowed Iran would respond. ""Israel knows very well that our response in the field of national security has always been fierce and accurate,"" he said.   Israeli Prime Minister Benjamin Netanyahu talks to the media on Feb. 20. (AP) THREAT LEVEL RAISED FOR US TROOPS IN IRAQ Overnight, Syrian state media reported a series of alleged Israeli airstrikes near Damascus, saying air defense systems had intercepted most of the missiles. Israeli media reports said the alleged airstrikes were on Iranian targets in response to the ship attack. Israel has struck hundreds of Iranian targets in neighboring Syria in recent years, and Netanyahu has repeatedly said Israel will not accept a permanent Iranian military presence there. Iran and its Lebanese proxy Hezbollah have provided military support to Syrian President Bashar Assad in the more than decade-long Syrian civil war. The Israeli military declined comment. Iran also has blamed Israel for a recent series of attacks, including another mysterious explosion last summer that destroyed an advanced centrifuge assembly plant at its Natanz nuclear facility and the killing of Mohsen Fakhrizadeh, a top Iranian scientist who founded the Islamic Republic’s military nuclear program two decades ago. Iran has repeatedly vowed to avenge Fakhrizadeh’s killing. CLICK HERE TO GET THE FOX NEWS APP ""It is most important that Iran doesn’t have nuclear weapons, with or without an agreement, this I also told to my friend Biden,"" Netanyahu said Monday. Iranian threats of retaliation have raised alarms in Israel since the signing of normalization deals with the United Arab Emirates and Bahrain in September.   ",2021-03-08 02:33:00
https://www.foxnews.com/world/israel-netanyahu-rush-limbaugh,fox,Israel's Netanyahu sends condolences to Rush Limbaugh's family ...," close      Video Biden will have call 'soon' with 'important' ally Israel: White House White House press secretary Jen Psaki says President Biden's first call to a leader in the Middle East region will be to Prime Minister Benjamin Netanyahu.Israeli Prime Minister Benjamin Netanyahu sent his condolences to conservative radio host Rush Limbaugh's family in a Thursday morning tweet.Politicians, pundits and celebrities shared memories of Limbaugh on Wednesday following his wife's announcement that the radio host had died after being diagnosed with late-stage lung cancer about a year ago.""I send my heartfelt condolences to the family of Rush Limbaugh,"" Netanyahu, a friend of former President Trump, said in the tweet. ""He was a great friend of Israel and he stood by us through thick and thin, always firm, never wavering. We shall miss him dearly.""Limbaugh was a staunch supporter of Israel, much like his friend, the former president, who formally recognized Jerusalem as Israel's capital and helped secure peace deals between Israel and a number of Middle Eastern countries during his presidency.RUSH LIMBAUGH, CONSERVATIVE TALK RADIO PIONEER, DEAD AT 70The Jewish Telegraphic Agency, an international Jewish news website, announced the news of the radio host's death Thursday, saying his views ""sharply divided American Jews.""Zev Chafets, a Jewish biographer who wrote the 2010 book ""An Army of One"" covering Limbaugh's life and career, said the media personality was ""very cautious about not saying anything disparaging American Jews as a collective ever"" in a Wednesday interview with the Agency.TWITTER LIBERALS CELEBRATE RUSH LIMBAUGH'S DEATH""It was very important considering the possibilities of anti-Semitism on the right that the biggest and most powerful voice in that community over 30 years was very clearly anything but an anti-Semite,"" Chafets said.  Radio talk show host Rush Limbaugh gestures as he makes remarks at the National Association of Broadcasters October 2, 2003 in Philadelphia, Pennsylvania. (Photo by William Thomas Cain/Getty Images) The radio host is considered one of the most influential media figures in American history and has played a consequential role in conservative politics since ""The Rush Limbaugh Show"" began in 1988. Perched behind his Golden EIB (Excellence in Broadcasting) Microphone, Limbaugh spent over three decades as arguably both the most beloved and polarizing person in American media.CLICK HERE TO GET THE FOX NEWS APPThe program that began 33 years ago on national syndication with only 56 radio stations grew to be the most listened-to radio show in the United States, airing on more than 600 stations, according to the show’s website. Up to 27 million people tuned in on a weekly basis and Limbaugh has lovingly referred to his passionate fan base as ""Dittoheads,"" as they would often say ""ditto"" when agreeing with the iconic radio host.In his final radio broadcast of 2020, Limbaugh thanked his listeners and supporters, revealing at the time that he had outlived his prognosis.""I wasn't expected to be alive today,"" he said. ""I wasn't expected to make it to October, and then to November, and then to December. And yet, here I am, and today, got some problems, but I'm feeling pretty good today.""TRIBUTES POUR IN FOR CONSERVATIVE 'LEGEND' RUSH LIMBAUGH: 'A HERO FOR THIS COUNTRY'Fox News' Brian Flood contributed to this report.  Audrey Conklin is a digital reporter for Fox News Digital and FOX Business. Email tips to audrey.conklin@fox.com or on Twitter at @audpants.",2021-03-08 02:33:00
